{
  "Arn": "arn:aws:service:us-east-1:123456789012:resource/example",
  "AuthenticationStrategy": "example-value",
  "Created": "example-value",
  "Description": "example-value",
  "EngineType": "STANDARD",
  "EngineVersion": "example-value",
  "Id": "id-abc123",
  "LatestRevision": "example-value",
  "Name": "example-resource",
  "Tags": "example-value"
}